TeamCode,TeamName,Country,TeamType,Active,ParticipationFrom,ExpectedQuarterlyCases,Address1,Address2,Town,County,Postcode,NhsOrganisation,NhsHospitalCode,AMBT_Groups,TRUST_Groups,TRUST_Names,SCN_Groups,SCN_Names,SHAC_Groups
469,Potters Bar Community Hospital,England,H,FALSE,,,Potters Bar Community Hospital,Barnet Road,Potters Bar,Hertforshire,EN6 2RY,Y,RY402,AMBT_RYC,TRUST_RY4,Hertfordshire Community NHS Trust,SCN_SCN002,East of England SCN,SHAC_ME
C243,Potters Bar Community Rehab Team,England,C,TRUE,26/03/2014 00:00,,Potters Bar Community Hospital,,,,EN6 2RY,Y,RY402,AMBT_RYC,TRUST_RY4,Hertfordshire Community NHS Trust,SCN_SCN002,East of England SCN,SHAC_SS
C383,Powys Community Stroke 6 Month Assessment Provider,Wales,C,TRUE,09/04/2015 00:00,,Newtown Hospital,Llanfair Road,Newtown,Powys,SY16 2DW,Y,,AMBT_WAL,TRUST_7A7,Powys Teaching Health Board,,,
221,Prince Charles Hospital,Wales,H,TRUE,,183,Gurnos,,Merthyr Tydfil,Mid Glamorgan,CF47 9DT,Y,7A52,AMBT_WAL,TRUST_7A5,Cwm Taf University Health Board,,,
230,Prince Philip Hospital,Wales,H,TRUE,,61,Bryngwyn Mawr,Dafan,Llanelli,Mid Glamorgan,SA14 8QF,Y,7A22,AMBT_WAL,TRUST_7A2,Hywel Dda Health Board,,,
220,Princess Alexandra Hospital,England,H,FALSE,,,Hamstel Road,,Harlow,Essex,CM20 1QX,Y,RQWG0,AMBT_RYC,TRUST_RQW,Princess Alexandra Hospital NHS Trust,SCN_SCN002,East of England SCN,SHAC_ME
222,Princess Elizabeth Hospital,Islands,H,FALSE,,,Le Vauquiedor,,St Martins,Guernsey,GY4 6UU,Y,YACG,AMBT_ISA2,TRUST_YAE,States of Guernsey Health and Social Services,,,
229,Princess Of Wales Hospital,Wales,H,TRUE,,68,Coity Road ,,Bridgend ,Mid Glamorgan,CF31 1RQ ,Y,7A32,AMBT_WAL,TRUST_7A3,Abertawe Bro Morgannwg University Health Board,,,
529,"Princess of Wales, Lickey Ward Community Stroke Inpatient Rehabilitation Team",England,H,FALSE,09/12/2015 00:00,,"Lickey WARD, Princess of Wales Community Hospital ",Stourbridge Road,Bromsgrove,West Midlands,B610BB,Y,R1ACG,AMBT_RYA,TRUST_R1A,Worcestershire Health and Care NHS Trust,SCN_SCN003,West Midlands SCN,SHAC_ME
231,Princess Royal Hospital Haywards Heath,England,H,FALSE,,,Lewes Road,,Haywards Heath,West Sussex,RH16 4EX,Y,RXH09,AMBT_RYD,TRUST_RXH,Brighton and Sussex University Hospitals NHS Trust,SCN_SCN009,South East SCN ,SHAC_SS
278,Princess Royal Hospital Telford,England,H,TRUE,,277,Apley Castle,Grainger Drive,Telford,Shropshire,TF1 6TF,Y,RXWAT,AMBT_RYA,TRUST_RXW,Shrewsbury and Telford Hospital NHS Trust,SCN_SCN003,West Midlands SCN,SHAC_ME
123,Princess Royal University Hospital HASU,England,H,TRUE,,284,Farnborough Common,,Orpington,Kent,BR6 8ND,Y,RJZ68,AMBT_RRU,TRUST_RJZ,King's College Hospital NHS Foundation Trust,SCN_SCN004,London SCN,SHAC_LN
330,Princess Royal University Hospital SU,England,H,TRUE,,,,,,,BR6 8ND,Y,RJZ68,AMBT_RRU,TRUST_RJZ,King's College Hospital NHS Foundation Trust,SCN_SCN004,London SCN,SHAC_LN
535,Pulross Centre 2B Neuro Rehabilitation Team,England,H,TRUE,16/01/2016 00:00,,Pulross Centre 47A ,Pulross Road London,London,London,SW9 8AE,Y,,AMBT_RRU,TRUST_RJ1,Guy's and St Thomas' NHS Foundation Trust,SCN_SCN004,London SCN,SHAC_LN
232,Queen Alexandra Hospital Portsmouth,England,H,TRUE,,307,Southwick Hill Road,Cosham,Portsmouth,Hampshire,PO6 3LY,Y,RHU03,AMBT_RYE,TRUST_RHU,Portsmouth Hospitals NHS Trust,SCN_SCN012,Wessex SCN ,SHAC_SS
431,Queen Alexandra Hospital Portsmouth - Inpatient Rehab Team (INACTIVE),England,H,FALSE,,,,,,,PO6 3LY,Y,,AMBT_RYE,TRUST_RHU,Portsmouth Hospitals NHS Trust,SCN_SCN012,Wessex SCN ,SHAC_SS
233,Queen Elizabeth Hospital Edgbaston,England,H,TRUE,,159,Queen Elizabeth Medical Centre,Edgbaston,Birmingham,West Midlands,B15 2TH,Y,RRK02,AMBT_RYA,TRUST_RRK,University Hospitals Birmingham NHS Foundation Trust,SCN_SCN003,West Midlands SCN,SHAC_ME
234,Queen Elizabeth Hospital Gateshead,England,H,TRUE,,,Sheriff Hill,,Gateshead,Tyne And Wear,NE9 6SX,Y,RR7EN,AMBT_RX6,TRUST_RR7,Gateshead Health NHS Foundation Trust,SCN_SCN007,North of England SCN ,SHAC_NN
236,Queen Elizabeth Hospital Kings Lynn,England,H,TRUE,,228,Gayton Road,,King's Lynn,Norfolk,PE30 4ET,Y,RCX70,AMBT_RYC,TRUST_RCX,Queen Elizabeth Hospital King's Lynn NHS Foundation Trust,SCN_SCN002,East of England SCN,SHAC_ME
163,Queen Elizabeth Hospital Woolwich,England,H,FALSE,,,Stadium Road,,London,Greater London,SE18 4QH,Y,RYQ50,AMBT_RRU,TRUST_RJ2,Lewisham and Greenwich NHS Trust,SCN_SCN004,London SCN,SHAC_LN
235,Queen Elizabeth the Queen Mother Hospital,England,H,TRUE,,129,St. Peters Road,,Margate,Kent,CT9 4AN,Y,RVV09,AMBT_RYD,TRUST_RVV,East Kent Hospitals University NHS Foundation Trust,SCN_SCN009,South East SCN ,SHAC_SS
328,Queen Mary Roehampton Neurorehabilitation Unit,England,H,TRUE,,,,,,,SW15 5PN,Y,RJ731,AMBT_RRU,TRUST_RJ7,St George's Healthcare NHS Trust,SCN_SCN004,London SCN,SHAC_LN
472,Queen Victoria Memorial Hospital,England,H,TRUE,01/04/2014 00:00,,Queen Victoria Memorial Hospital,14 Tewin Road,"Welwyn Garden City	",Hertfordshire,"AL7 1BW	",Y,RY412,AMBT_RYC,TRUST_RY4,Hertfordshire Community NHS Trust,SCN_SCN002,East of England SCN,SHAC_ME
534,Queen's Medical Centre - Nottingham,England,H,TRUE,01/01/2015 00:00,,"MRI centre, B Floor, West Block",NUH QMC Campus,Nottingham,Nottinghamshire,NG7 2UH,Y,RX1RA,AMBT_RX9,TRUST_RX1,Nottingham University Hospitals NHS Trust,SCN_SCN001,East Midlands SCN,SHAC_ME
124,Queens Hospital Burton upon Trent,England,H,TRUE,,137,Belvedere Road,,Burton -On- Trent,Staffordshire,DE13 0RB,Y,RJF02,AMBT_RYA,TRUST_RJF,Burton Hospitals NHS Foundation Trust,SCN_SCN003,West Midlands SCN,SHAC_ME
C237,Queens Hospital Romford ESD Team,England,C,TRUE,,,Queens Hospital,Rom Valley Way,Romford,Essex,RM7 0AG,Y,RF4QH,AMBT_RYC,TRUST_RF4,"Barking, Havering and Redbridge University Hospitals NHS Trust",SCN_SCN004,London SCN,SHAC_LN
219,Queens Hospital Romford HASU,England,H,TRUE,,345,Rom Valley Way,,Romford,Essex,RM7 0AG,Y,RF4QH,AMBT_RRU,TRUST_RF4,"Barking, Havering and Redbridge University Hospitals NHS Trust",SCN_SCN004,London SCN,SHAC_LN
335,Queens Hospital Romford SU,England,H,TRUE,,,,,,,RM7 0AG,Y,RF4QH,AMBT_RRU,TRUST_RF4,"Barking, Havering and Redbridge University Hospitals NHS Trust",SCN_SCN004,London SCN,SHAC_LN
C258,Redbridge Intermediate Care & Community Stroke Service,England,C,TRUE,10/03/2014 00:00,,120 High Road,South Woodford,London,,E18 2QS,Y,,AMBT_RRU,TRUST_RAT,North East London NHS Foundation Trust,SCN_SCN004,London SCN,SHAC_LN
C357,Redbridge Stroke Association 6 Month Assessment Provider,England,C,TRUE,01/02/2015 00:00,,Blue Building,4-8 Whites Grounds,,London,SE1 3LA,N,,AMBT_RRU,TRUST_SA1,Stroke Association,SCN_SCN004,London SCN,SHAC_LN
325,Regional Rehabilitation Unit - Northwick Park Hospital ,England,H,FALSE,,,,,,,HA1 3UJ,Y,RV820,AMBT_RRU,TRUST_R1K,London North West Healthcare NHS Trust,SCN_SCN004,London SCN,SHAC_LN
C182,Rehabilitation and Enablement Team (North -SEPT),England,C,FALSE,,,John Bunyan House - Bedford Health Village,3 Kimbolton Road,Bedford,,MK40 2NT,Y,RWNP9,AMBT_RYC,TRUST_R1L,Essex Partnership University NHS Foundation Trust,SCN_SCN002,East of England SCN,SHAC_ME
C181,Rehabilitation and Enablement Team (South Central -SEPT),England,C,FALSE,,,Disability Resource Centre,Pointers Road,Dunstable,,LU5 4TP,Y,RWNN6,AMBT_RYC,TRUST_R1L,Essex Partnership University NHS Foundation Trust,SCN_SCN002,East of England SCN,SHAC_ME
C136,Richmond Community Neuro-Rehab Team,England,C,TRUE,,,Richmond Rehab Unit,22 Evelyn Road,Richmond,,TW9 2TF,Y,RY906,AMBT_RRU,TRUST_RY9,Hounslow and Richmond Community Healthcare NHS Trust ,SCN_SCN004,London SCN,SHAC_LN
C183,Richmond ESD Team,England,C,TRUE,,,Richmond Rehab Unit,22 Evelyn Road,Richmond,,TW9 2TF,Y,RY906,AMBT_RRU,TRUST_RY9,Hounslow and Richmond Community Healthcare NHS Trust ,SCN_SCN004,London SCN,SHAC_LN
410,Robertson Unit - Willesden Centre for Health and Care,England,H,FALSE,,,Robertson Unit,Willesden Centre for Health and Care,,,NW10 3RY,Y,RV837,AMBT_RRU,TRUST_R1K,London North West Healthcare NHS Trust,SCN_SCN004,London SCN,SHAC_LN
115,Rochdale Infirmary,England,H,FALSE,,,Whitehall Street,,Rochdale,Lancashire,OL12 0NB,Y,RW604,AMBT_RX7,TRUST_RW6,Pennine Acute Hospitals NHS Trust,SCN_SCN006,Greater Manchester and Eastern Cheshire SCN,SHAC_NN
511,"Rossmore Unit, Hull Integrated Stroke Service",England,H,TRUE,01/12/2014 00:00,,Rossmore Nursing Home/Stroke Unit,68 Sunnybank,Hull,,HU3 1LQ,Y,RV91K,AMBT_RX8,TRUST_RV9,Humber NHS Foundation Trust,SCN_SCN008,Yorkshire and The Humber SCN,SHAC_NN
C115,Rotherham Community Stroke Team,England,C,TRUE,,,"Moorgate road, Oakwood",,Rotherham,South Yorkshire ,S60 2UD,Y,RFRPA,AMBT_RX8,TRUST_RFR,Rotherham NHS Foundation Trust,SCN_SCN008,Yorkshire and The Humber SCN,SHAC_NN
C116,Rotherham ESD Team,England,C,TRUE,,,"Moorgate road, Oakwood",,,,S60 2UD,Y,RFRPA,AMBT_RX8,TRUST_RFR,Rotherham NHS Foundation Trust,SCN_SCN008,Yorkshire and The Humber SCN,SHAC_NN
248,Rotherham Hospital,England,H,TRUE,,135,Moorgate Road,,Rotherham,South Yorkshire,S60 2UD,Y,RFRPA,AMBT_RX8,TRUST_RFR,Rotherham NHS Foundation Trust,SCN_SCN008,Yorkshire and The Humber SCN,SHAC_NN
411,Rotherham Intermediate Care Team,England,H,TRUE,,,"Moorgate road, Oakwood",,,,S60 2UD,Y,RFRPA,AMBT_RX8,TRUST_RFR,Rotherham NHS Foundation Trust,SCN_SCN008,Yorkshire and The Humber SCN,SHAC_NN
102,Royal Albert Edward Infirmary,England,H,TRUE,,,Wigan Lane,,Wigan,Lancashire,WN1 2NN,Y,RRF02,AMBT_RX7,TRUST_RRF,"Wrightington, Wigan and Leigh NHS Foundation Trust",SCN_SCN006,Greater Manchester and Eastern Cheshire SCN,SHAC_NN
238,Royal Berkshire Hospital,England,H,TRUE,,256,Royal Berkshire Hospital,London Road,Reading,Berkshire,RG1 5AN,Y,RHW01,AMBT_RYE,TRUST_RHW,Royal Berkshire NHS Foundation Trust,SCN_SCN011,Thames Valley SCN ,SHAC_SS
116,Royal Blackburn Hospital,England,H,TRUE,,213,Infirmary Road,,Blackburn,Lancashire,BB2 3HH,Y,RXR20,AMBT_RX7,TRUST_RXR,East Lancashire Hospitals NHS Trust,SCN_SCN005,North West Coast SCN,SHAC_NN
118,Royal Bolton Hospital,England,H,TRUE,,,Minerva Road,Farnworth,Bolton,Lancashire,BL4 0JR,Y,RMC01,AMBT_RX7,TRUST_RMC,Bolton NHS Foundation Trust,SCN_SCN006,Greater Manchester and Eastern Cheshire SCN,SHAC_NN
119,Royal Bournemouth General Hospital,England,H,TRUE,,232,Castle Lane East,,Bournemouth,Dorset,BH7 7DW,Y,RDZ20,AMBT_RYF,TRUST_RDZ,Royal Bournemouth and Christchurch Hospitals NHS Foundation Trust,SCN_SCN012,Wessex SCN ,SHAC_SS
C111,Royal Bournemouth Hospital ESD Team,England,C,TRUE,,,"Castle Lane East	",,Bournemouth,Dorset,BH7 7DW,Y,RNZ14,AMBT_RYF,TRUST_RDZ,Royal Bournemouth and Christchurch Hospitals NHS Foundation Trust,SCN_SCN012,Wessex SCN ,SHAC_SS
239,Royal Cornwall Hospital,England,H,TRUE,,253,Treliske,,Truro,Cornwall,TR1 3LJ,Y,REF12,AMBT_RYF,TRUST_REF,Royal Cornwall Hospitals NHS Trust,SCN_SCN010,South West SCN ,SHAC_SS
141,Royal Derby Hospital,England,H,TRUE,,283,Uttoxeter Road,,Derby,Derbyshire,DE22 3NE,Y,RTGFG,AMBT_RX9,TRUST_RTG,Derby Hospitals NHS Foundation Trust,SCN_SCN001,East Midlands SCN,SHAC_ME
240,Royal Devon and Exeter Hospital,England,H,TRUE,,229,Barrack Road,,Exeter,Devon,EX2 5DW,Y,RH801,AMBT_RYF,TRUST_RH8,Royal Devon and Exeter NHS Foundation Trust,SCN_SCN010,South West SCN ,SHAC_SS
C336,Royal Free Community Neuro Rehab Team,England,C,FALSE,10/11/2014 00:00,,OYAL FREE NEUROLOGICAL REHABILITATION CENTRE,"EDGWARE COMMUNITY HOSPITAL	",BURNT OAK BROADWAY,LONDON,HA8 0AD,Y,,AMBT_RRU,TRUST_RAL,Royal Free London NHS Foundation Trust,SCN_SCN004,London SCN,SHAC_LN
242,Royal Free Hospital,England,H,TRUE,,,Pond Street,,London,Greater London,NW3 2QG,Y,RAL01,AMBT_RRU,TRUST_RAL,Royal Free London NHS Foundation Trust,SCN_SCN004,London SCN,SHAC_LN
509,Royal Free Neuro Rehabilitation Centre,England,H,TRUE,10/11/2014 00:00,,ROYAL FREE NEUROLOGICAL REHABILITATION CENTRE,"EDGWARE COMMUNITY HOSPITAL	",BURNT OAK BROADWAY,LONDON,HA8 0AD,Y,R1K21,AMBT_RRU,TRUST_RAL,Royal Free London NHS Foundation Trust,SCN_SCN004,London SCN,SHAC_LN
243,Royal Glamorgan,Wales,H,TRUE,,,Ynysmaerdy,Llantrisant,Pontyclun,Rhondda Cynon Taff,CF72 8XR,Y,7A53,AMBT_WAL,TRUST_7A5,Cwm Taf University Health Board,,,
162,Royal Gwent Hospital,Wales,H,TRUE,,184,Cardiff Road,,Newport,Gwent,NP20 2UB,Y,7A61,AMBT_WAL,TRUST_7A6,Aneurin Bevan University Health Board,,,
244,Royal Hallamshire Hospital,England,H,TRUE,,292,Glossop Road,,Sheffield,South Yorkshire,S10 2JF,Y,RHQHH,AMBT_RX8,TRUST_RHQ,Sheffield Teaching Hospitals NHS Foundation Trust,SCN_SCN008,Yorkshire and The Humber SCN,SHAC_NN
245,Royal Hampshire County Hospital,England,H,TRUE,,133,Romsey Road,,Winchester,Hampshire,SO22 5DG,Y,RN541,AMBT_RYE,TRUST_RN5,Hampshire Hospitals NHS Foundation Trust,SCN_SCN012,Wessex SCN ,SHAC_SS
246,Royal Lancaster Infirmary,England,H,TRUE,,101,Ashton Road,,Lancaster,Lancashire,LA1 4RP,Y,RTX02,AMBT_RX7,TRUST_RTX,University Hospitals of Morecambe Bay NHS Foundation Trust,SCN_SCN005,North West Coast SCN,SHAC_NN
C476,Royal Liverpool and Broadgreen Hospital ESD Team,England,C,TRUE,01/03/2017 00:00,,The Royal Liverpool and Broadgreen University Hosp,Prescot Street,Liverpool,Liverpool,L7 8XP,Y,,AMBT_RX7,TRUST_RQ6,Royal Liverpool and Broadgreen University Hospitals NHS Trust,SCN_SCN005,North West Coast SCN,SHAC_NN
247,Royal Liverpool University Hospital,England,H,TRUE,,196,Prescot Street,,Liverpool,Merseyside,L7 8XP,Y,RQ617,AMBT_RX7,TRUST_RQ6,Royal Liverpool and Broadgreen University Hospitals NHS Trust,SCN_SCN005,North West Coast SCN,SHAC_NN
193,Royal London Hospital HASU,England,H,TRUE,,267,Whitechapel,,London,Greater London,E1 1BB,Y,R1H12,AMBT_RRU,TRUST_R1H,Barts Health NHS Trust,SCN_SCN004,London SCN,SHAC_LN
334,Royal London Hospital SU,England,H,TRUE,,,,,,,E1 1BB,Y,R1H12,AMBT_RRU,TRUST_R1H,Barts Health NHS Trust,SCN_SCN004,London SCN,SHAC_LN
218,Royal Oldham Hospital,England,H,TRUE,,,Rochdale Road,,Oldham,Lancashire,OL1 2JH,,RW603,AMBT_RX7,TRUST_RW6,Pennine Acute Hospitals NHS Trust,SCN_SCN006,Greater Manchester and Eastern Cheshire SCN,SHAC_NN
249,Royal Preston Hospital,England,H,TRUE,,167,Sharoe Green Lane,Fulwood,Preston,Lancashire,PR2 9HT,Y,RXN02,AMBT_RX7,TRUST_RXN,Lancashire Teaching Hospitals NHS Foundation Trust,SCN_SCN005,North West Coast SCN,SHAC_NN
251,Royal Shrewsbury Hospital,England,H,TRUE,,,Mytton Oak Road,,Shrewsbury,Shropshire,SY3 8XQ,Y,RXWAS,AMBT_RYA,TRUST_RXW,Shrewsbury and Telford Hospital NHS Trust,SCN_SCN003,West Midlands SCN,SHAC_ME
274,Royal Stoke University Hospital,England,H,TRUE,,352,Princes Road,,Stoke-On-Trent,Staffordshire,ST4 7LN,Y,RJEHQ,AMBT_RYA,TRUST_RJE,University Hospitals of North Midlands NHS Trust,SCN_SCN003,West Midlands SCN,SHAC_ME
252,Royal Surrey County Hospital,England,H,TRUE,,,Egerton Road,,Guildford,Surrey,GU2 7XX,Y,RA201,AMBT_RYD,TRUST_RA2,Royal Surrey County Hospital NHS Foundation Trust,SCN_SCN009,South East SCN ,SHAC_SS
250,Royal Sussex County Hospital,England,H,TRUE,,174,Eastern Road,,Brighton,East Sussex,BN2 5BE,Y,RXH01,AMBT_RYD,TRUST_RXH,Brighton and Sussex University Hospitals NHS Trust,SCN_SCN009,South East SCN ,SHAC_SS
111,Royal United Hospital Bath,England,H,TRUE,,208,Combe Park,,Bath,Avon,BA1 3NG,Y,RD130,AMBT_RX5,TRUST_RD1,Royal United Hospital Bath NHS Trust,SCN_SCN010,South West SCN ,SHAC_SS
254,Royal Victoria Hospital Belfast,Northern Ireland,H,TRUE,,155,274 Grosvenor Road,,Belfast,County Antrim,BT12 6BA,,ZT001,AMBT_NIA,TRUST_ZT001,Belfast Health and Social Care Trust,,,
255,Royal Victoria Infirmary,England,H,TRUE,,320,Queen Victoria Road,,Newcastle Upon Tyne,Tyne And Wear,NE1 4LP,Y,RTD02,AMBT_RX6,TRUST_RTD,Newcastle upon Tyne Hospitals NHS Foundation Trust,SCN_SCN007,North of England SCN ,SHAC_NN
474,Runcie Wing - St Alban's City Hospital,England,H,FALSE,,,"Runcie Wing, St Alban's City Hospital",Waverley Road,St Albans,,AL3 5PN,Y,RY417,AMBT_RYC,TRUST_RY4,Hertfordshire Community NHS Trust,SCN_SCN002,East of England SCN,SHAC_ME
253,Russells Hall Hospital,England,H,TRUE,,181,Pensnett Road,,Dudley,West Midlands,DY1 2HQ,Y,RNA01,AMBT_RYA,TRUST_RNA,Dudley Group of Hospitals NHS Foundation Trust,SCN_SCN003,West Midlands SCN,SHAC_ME
504,"Saffron Walden Community Hospital, Avocet Ward",England,H,FALSE,,,Saffron Walden Community Hospital,Radwinter Road,Saffron Walden,Essex,CB11 3HY,Y,,AMBT_RYC,TRUST_R1L,Essex Partnership University NHS Foundation Trust,SCN_SCN002,East of England SCN,SHAC_ME
C172,Salford Community Neurological Rehab Team,England,C,FALSE,,,Sandringham House,Windsor Street,Salford,,M5 4DG,Y,RM301,AMBT_RX7,TRUST_RM3,Salford Royal NHS Foundation Trust,SCN_SCN006,Greater Manchester and Eastern Cheshire SCN,SHAC_NN
C207,Salford ESD Team,England,C,TRUE,,,Sandringham House,Windsor Street,Salford,,M5 4DG,Y,RM301,AMBT_RX7,TRUST_RM3,Salford Royal NHS Foundation Trust,SCN_SCN006,Greater Manchester and Eastern Cheshire SCN,SHAC_NN
267,Salford Royal Hospital,England,H,TRUE,,628,Stott Lane,,Salford,Greater Manchester,M6 8HD,Y,RM301,AMBT_RX7,TRUST_RM3,Salford Royal NHS Foundation Trust,SCN_SCN006,Greater Manchester and Eastern Cheshire SCN,SHAC_NN
990,Salford Royal Rapid TIA service,England,H,TRUE,01/05/2017 00:00,,Acute Stroke Unit,Salford Royal,Eccles,Salford,M6 8HD,Y,,AMBT_RX7,TRUST_RM3,Salford Royal NHS Foundation Trust,SCN_SCN006,Greater Manchester and Eastern Cheshire SCN,SHAC_NN
C196,Salford Stroke Association IASS - 6 Month Assessment Provider,England,C,TRUE,,,The Stroke Association Office,"6th Floor St James’s House, Pendleton Way",Salford,,M6 5FW ,N,,AMBT_RX7,TRUST_SA1,Stroke Association,SCN_SCN006,Greater Manchester and Eastern Cheshire SCN,SHAC_NN
256,Salisbury District Hospital,England,H,TRUE,,101,Salisbury District Hospital,Odstock Road,Salisbury,Wiltshire,SP2 8BJ,Y,RNZ02,AMBT_RX5,TRUST_RNZ,Salisbury NHS Foundation Trust,SCN_SCN010,South West SCN ,SHAC_SS
506,Samuel Johnson Community Hospital,England,H,TRUE,01/08/2014 00:00,,Samuel Johnson Hospital,Trent valley road,Lichfield,Staffs,WS13 6EF,Y,RJF04,AMBT_RYA,TRUST_RJF,Burton Hospitals NHS Foundation Trust,SCN_SCN003,West Midlands SCN,SHAC_ME
C471,Sandwell and West Birmingham ESD team,England,C,TRUE,08/12/2016 00:00,,"Sandwell and West Birmingham NHS trust, ",Lyndon,West Bromwich,Sandwell,B71 4HJ,Y,,AMBT_RYA,TRUST_RXK,Sandwell and West Birmingham Hospitals NHS Trust,SCN_SCN003,West Midlands SCN,SHAC_ME
257,Sandwell District Hospital,England,H,TRUE,,164,Lyndon,,West Bromwich,West Midlands,B71 4HJ,Y,RXK01,AMBT_RYA,TRUST_RXK,Sandwell and West Birmingham Hospitals NHS Trust,SCN_SCN003,West Midlands SCN,SHAC_ME
C341,Sandwell Stroke Association 6 Month Assessment Provider,England,C,TRUE,27/10/2014 00:00,,"Stroke Association, NHS Walk in Centre",Parsonage Street,West Bromwich,,B71 4DL,N,,AMBT_RYA,TRUST_SA1,Stroke Association,SCN_SCN003,West Midlands SCN,SHAC_ME
477,Sapphire Unit - Gravesham Community Hospital,England,H,TRUE,,,"Sapphire Unit, Gravesham Community Hospital",Bath Street,Gravesend,Kent,DA11 0DG,Y,RYYDN,AMBT_RYD,TRUST_RYY,Kent Community Health NHS Trust ,SCN_SCN009,South East SCN ,SHAC_SS
C389,Scarborough and Rydale Community Stroke Rehabilitation,England,C,TRUE,01/05/2015 00:00,,Scarborough Hospital,Woodlands Drive,Scarborough,North Yorkshire,YO12 6QL,Y,,AMBT_RX8,TRUST_RCB,York Teaching Hospital NHS Foundation Trust,SCN_SCN008,Yorkshire and The Humber SCN,SHAC_NN
C390,Scarborough and Rydale ESD Team,England,C,TRUE,01/05/2015 00:00,,Scarborough Hospital,Woodlands Drive,Scarborough,North Yorkshire,YO12 6QL,Y,,AMBT_RX8,TRUST_RCB,York Teaching Hospital NHS Foundation Trust,SCN_SCN008,Yorkshire and The Humber SCN,SHAC_NN
258,Scarborough General Hospital,England,H,TRUE,,,Woodlands Drive,,Scarborough,North Yorkshire,YO12 6QL,Y,RCC25,AMBT_RX8,TRUST_RCB,York Teaching Hospital NHS Foundation Trust,SCN_SCN008,Yorkshire and The Humber SCN,SHAC_NN
260,Scunthorpe General Hospital,England,H,TRUE,,160,Cliff Gardens,,Scunthorpe,North East Lincolnshire,DN15 7BH,Y,RJL32,AMBT_RX9,TRUST_RJL,Northern Lincolnshire and Goole Hospitals NHS Foundation Trust,SCN_SCN008,Yorkshire and The Humber SCN,SHAC_NN
C156,Sheffield Community Stroke ESD Team,England,C,TRUE,,,89 Green Lane,,Ecclesfield,,S35 9WY,Y,RHQNG,AMBT_RX8,TRUST_RHQ,Sheffield Teaching Hospitals NHS Foundation Trust,SCN_SCN008,Yorkshire and The Humber SCN,SHAC_NN
C411,Sheffield Community Stroke Rehabilitation Team,England,C,TRUE,01/08/2015 00:00,,"CSS, Lightwood House, ","Lightwood Lane, ",Sheffield,South Yorkshire,S8 8BG,Y,,AMBT_RX8,TRUST_RHQ,Sheffield Teaching Hospitals NHS Foundation Trust,SCN_SCN008,Yorkshire and The Humber SCN,SHAC_NN
C380,Sheffield Stroke Rehab and 6 Month Assessment Provider,England,C,TRUE,27/03/2015 00:00,,Michael Carlisle Centre,75 Osborne Road,Sheffield,South Yorkshire,S11 9BF,Y,,AMBT_RX8,TRUST_RHQ,Sheffield Teaching Hospitals NHS Foundation Trust,SCN_SCN008,Yorkshire and The Humber SCN,SHAC_NN
412,Sheppey Community Hospital,England,H,FALSE,,,Eastern and Coastal NHS Trust,Plover Hill,"Minster, Sheppey",Kent,ME12 3LT,Y,,AMBT_RYD,TRUST_RYY,Kent Community Health NHS Trust ,SCN_SCN009,South East SCN ,SHAC_SS
416,Shepton Mallet Community Hospital,England,H,TRUE,,,Bucklers Way,Old Wells Road,Shepton Mallet,Somerset,BA4 4PG,Y,RH5F7,AMBT_RYF,TRUST_RH5,Somerset Partnership NHS Foundation Trust,SCN_SCN010,South West SCN ,SHAC_SS
C344,Shepway Community Stroke Rehab Team,England,C,FALSE,01/11/2014 00:00,,Royal Victoria Hospital,,Folkestone,Kent,CT19 5BN,N,,AMBT_RYD,TRUST_RYY,Kent Community Health NHS Trust ,SCN_SCN009,South East SCN ,SHAC_SS
C193,Shepway ESD Team,England,C,FALSE,,,Royal Victoria Hospital,Radnor Park  Road West,Folkestone,Kent,CT19 5BN,Y,RYYCW,AMBT_RYD,TRUST_RYY,Kent Community Health NHS Trust ,SCN_SCN009,South East SCN ,SHAC_SS
C250,Shrewsbury and Telford ESD Team,England,C,TRUE,,,"Physiotherapy Department, Princess Royal Hospital",,Telford, Shropshire,"TF1 6TF	",Y,RXWAT,AMBT_RYA,TRUST_RXW,Shrewsbury and Telford Hospital NHS Trust,SCN_SCN003,West Midlands SCN,SHAC_ME
C429,Shropshire Community Neuro Rehab Team,England,C,TRUE,01/01/2016 00:00,,Shropshire Rehabilitation Centre,Lancaster Road,Harlescott,Shrewsbury,SY1 3NJ,Y,,AMBT_RYA,TRUST_R1D,SHROPSHIRE COMMUNITY HEALTH NHS TRUST,SCN_SCN003,West Midlands SCN,SHAC_ME
480,Singleton Hospital,Wales,H,TRUE,,,Singleton Hospital,Sketty Lane,Swansea,,SA2 8QA,Y,7A3C4,AMBT_WAL,TRUST_7A3,Abertawe Bro Morgannwg University Health Board,,,
507,Sir Robert Peel Community Hospital,England,H,TRUE,01/08/2014 00:00,,Sir Robert Peel Community Hospital,Plantation lane Mile Oak,Tamworth,Staffs,B78 3NG,Y,RTG50,AMBT_RYA,TRUST_RJF,Burton Hospitals NHS Foundation Trust,SCN_SCN003,West Midlands SCN,SHAC_ME
C395,Sirona Care and Health Community Rehab Team,England,C,TRUE,01/06/2015 00:00,,Crown Way,Warmley,Bristol,South Gloucestershire,BS308FJ,N,,AMBT_RYF,TRUST_NLX,Sirona Care &amp; Health,SCN_SCN010,South West SCN ,SHAC_SS
C426,Solent Stroke 6 Month Assessment Provider,England,C,TRUE,02/10/2015 00:00,,"Community Stroke Team, Western Community Hospital",Willima Mcleod Way,Millbrook,Southampton,SO16 4XE,Y,,AMBT_RYE,TRUST_R1C,Solent NHS Trust,SCN_SCN012,Wessex SCN ,SHAC_SS
C293,Solent Stroke ESD Team (Southampton),England,C,TRUE,01/05/2014 00:00,,Oakhill House,2-6 Romsey Road,Southampton,Hampshire,SO16 4BZ,Y,,AMBT_RYE,TRUST_R1C,Solent NHS Trust,SCN_SCN012,Wessex SCN ,SHAC_SS
309,Solihull Hospital,England,H,TRUE,,,Lode Lane,,Solihull,West Midlands,B91 2JL,Y,RR109,AMBT_RYA,TRUST_RR1,Heart of England NHS Foundation Trust,SCN_SCN003,West Midlands SCN,SHAC_ME
C409,Solihull Hospital ESD Team,England,C,TRUE,01/07/2015 00:00,,"Solihull Hospital,",Lode Lane,Solihull,West Midlands,B91 2JL,Y,,AMBT_RYA,TRUST_RR1,Heart of England NHS Foundation Trust,SCN_SCN003,West Midlands SCN,SHAC_ME
C278,Somerset 6 Month Assessment Provider,England,C,TRUE,,,South Petherton Community Hospital,Bernard Way,South Petherton,Somerset,TA13 5EF,Y,,AMBT_RYF,TRUST_RH5,Somerset Partnership NHS Foundation Trust,SCN_SCN010,South West SCN ,SHAC_SS
C132,Somerset Partnership Community Rehab Team,England,C,TRUE,,,Bucklers Way,,,,BA4 4PG,Y,RH5F7,AMBT_RYF,TRUST_RH5,Somerset Partnership NHS Foundation Trust,SCN_SCN010,South West SCN ,SHAC_SS
C131,Somerset Partnership ESD Team,England,C,TRUE,,,Bernard Way,,,,TA13 5EF,Y,RH5G1,AMBT_RYF,TRUST_RH5,Somerset Partnership NHS Foundation Trust,SCN_SCN010,South West SCN ,SHAC_SS
C355,South Cheshire and Vale Royal Community Stroke Rehab Team,England,C,TRUE,,,Eagle Bridge Health Centre,Dunwoody Way,Crewe,Cheshire,CW1 3AW,Y,,AMBT_RX7,TRUST_RJN,East Cheshire NHS Trust,SCN_SCN006,Greater Manchester and Eastern Cheshire SCN,SHAC_NN
C356,South Cheshire and Vale Royal Stroke ESD Team,England,C,TRUE,,,Eagle Bridge Health Centre,Dunwoody Way,Crewe,Cheshire,CW1 3AW,Y,,AMBT_RX7,TRUST_RJN,East Cheshire NHS Trust,SCN_SCN006,Greater Manchester and Eastern Cheshire SCN,SHAC_NN
C397,South Derbyshire and South Dales ESD,England,C,TRUE,01/06/2015 00:00,,Newholme Hospital,Baslow Road,Bakewell,Derbyshire,DE45 1AD,Y,,AMBT_RX9,TRUST_RY8,DERBYSHIRE COMMUNITY HEALTH SERVICES NHS FOUNDATION TRUST,SCN_SCN001,East Midlands SCN,SHAC_ME
C286,South East Oxfordshire ESD Team,England,C,TRUE,,,Wallingford Community Hospital,Reading Rd,Wallingford,Oxfordshire,"OX10 9DU	",Y,,AMBT_RYE,TRUST_RNU,Oxford Health NHS Foundation Trust,SCN_SCN011,Thames Valley SCN ,SHAC_SS
C432,South East Staffordshire Community Neuro Rehab Team,England,C,TRUE,01/04/2016 00:00,,Sir Robert Peel Hospital,Plantation Lane,Tamworth,Staffordshire,B78 3NG,Y,,AMBT_RYA,TRUST_R1E,Staffordshire and Stoke-on-Trent Partnership NHS Trust,SCN_SCN003,West Midlands SCN,SHAC_ME
C436,South Kent Coast Community Stroke Rehab Team,England,C,TRUE,,,Royal Victoria Hospital,,Folkstone,Kent,CT19 5BN,Y,,AMBT_RYD,TRUST_RYY,Kent Community Health NHS Trust ,SCN_SCN009,South East SCN ,SHAC_SS
C437,South Kent Coast ESD Team,England,C,TRUE,,,Royal Victoria Hospital,,Deal,Kent,CT14 9UA,Y,,AMBT_RYD,TRUST_RYY,Kent Community Health NHS Trust ,SCN_SCN009,South East SCN ,SHAC_SS
422,South Molton Hospital,England,H,FALSE,,,Widgery Drive,,South Molton,Devon,EX36 4DP,Y,RBZ99,AMBT_RYF,TRUST_RBZ,Northern Devon Healthcare NHS Trust,SCN_SCN010,South West SCN ,SHAC_SS
