TeamCode,TeamName,Country,TeamType,Active,ParticipationFrom,ExpectedQuarterlyCases,Address1,Address2,Town,County,Postcode,NhsOrganisation,NhsHospitalCode,AMBT_Groups,TRUST_Groups,TRUST_Names,SCN_Groups,SCN_Names,SHAC_Groups
C268,Locala (North Kirklees) Stroke ESD Team,England,C,TRUE,,,Eddercliffe Centre,,,,WF15 6LP ,N,,AMBT_RX8,TRUST_NL8,Locala Community Partnerships CIC,SCN_SCN008,Yorkshire and The Humber SCN,SHAC_NN
487,Longridge Community Hospital,England,H,TRUE,,,St wilfrids Terrace,Longridge,"Preston	",Lancashire,PR3 3WQ,Y,RW5AQ,AMBT_RX7,TRUST_RW5,Lancashire Care NHS Foundation Trust,SCN_SCN005,North West Coast SCN,SHAC_NN
344,Lord Byron Ward - Brookfields Hospital,England,H,FALSE,,,"The Priory, Priory Road",,,,CB1 3DF,Y,RYV01,AMBT_RYC,TRUST_RYV,Cambridgeshire Community Services NHS Trust ,SCN_SCN002,East of England SCN,SHAC_ME
C229,Lower Lea Valley Community Rehab Team,England,C,TRUE,,,126 Crossbrook Street  ,,Cheshunt,Hertfordshire,EN8 8JH,Y,RY426,AMBT_RYC,TRUST_RY4,Hertfordshire Community NHS Trust,SCN_SCN002,East of England SCN,SHAC_ME
339,Lurgan Hospital,Northern Ireland,H,FALSE,,,63 Lurgan Road,,Portadown,Armagh,bt63 5qq,Y,,AMBT_NIA,TRUST_ZT003,Southern Health and Social Care Trust,,,
185,Luton and Dunstable Hospital,England,H,TRUE,,132,Lewsey Road,,Luton,Bedfordshire,LU4 0DZ,Y,RC971,AMBT_RYC,TRUST_RC9,Luton and Dunstable University Hospital NHS Foundation Trust,SCN_SCN002,East of England SCN,SHAC_ME
C287,Lymington New Forest ESD team,England,C,TRUE,,,Lymington New Forest Hospital,Wellworthy Road,Lymington,,S041 8QD,Y,,AMBT_RYE,TRUST_RW1,Southern Health NHS Foundation Trust ,SCN_SCN012,Wessex SCN ,SHAC_SS
314,Lymington New Forest Hospital,England,H,TRUE,,,"Wellworthy Road	",,Lymington,Hampshire,SO41 8QD,Y,RW1YM,AMBT_RYE,TRUST_RW1,Southern Health NHS Foundation Trust ,SCN_SCN012,Wessex SCN ,SHAC_SS
194,Macclesfield District General Hospital,England,H,FALSE,,,Victoria Road,,Macclesfield,Cheshire,SK10 3BL,Y,RJN71,AMBT_RX7,TRUST_RJN,East Cheshire NHS Trust,SCN_SCN006,Greater Manchester and Eastern Cheshire SCN,SHAC_NN
301,Maelor Hospital,Wales,H,TRUE,,103,Croesnewydd Road,Wrexham Technology Park,Wrexham,Wrexham,LL13 7TD,Y,7A12,AMBT_WAL,TRUST_7A1,Betsi Cadwaladr University Health Board,,,
196,Maidstone District General Hospital,England,H,TRUE,,95,Hermitage Lane,,Maidstone,Kent,ME16 9QQ,Y,RWF03,AMBT_RYD,TRUST_RWF,Maidstone and Tunbridge Wells NHS Trust,SCN_SCN009,South East SCN ,SHAC_SS
202,Manchester Royal Infirmary,England,H,TRUE,,,Oxford Road,,Manchester,Greater Manchester,M13 9WL,Y,RW3MR,AMBT_RX7,TRUST_R0A,Manchester University NHS Foundation Trust,SCN_SCN006,Greater Manchester and Eastern Cheshire SCN,SHAC_NN
297,Manor Hospital,England,H,TRUE,,116,Moat Road,,Walsall,West Midlands,WS2 9PS,Y,RBK02,AMBT_RYA,TRUST_RBK,Walsall Healthcare NHS Trust,SCN_SCN003,West Midlands SCN,SHAC_ME
195,Mater Infirmorum Hospital,Northern Ireland,H,FALSE,,,45-51 Crumlin Road,,Belfast,County Antrim,BT14 6AB,Y,,AMBT_NIA,TRUST_ZT001,Belfast Health and Social Care Trust,,,
488,Meadowfield Residential Intermediate Care Unit,England,H,TRUE,,,Meadowfield residential Home,Meadowfield,"Preston	",Lancashire,PR2 9NX,Y,RW5EE,AMBT_RX7,TRUST_RW5,Lancashire Care NHS Foundation Trust,SCN_SCN005,North West Coast SCN,SHAC_NN
423,Median Road Intermediate Care Unit,England,H,FALSE,,,Median Road Resource Centre ,,Hackney ,London,"E5 0PF	",Y,RQXM1,AMBT_RRU,TRUST_RQX,Homerton University Hospital NHS Foundation Trust,SCN_SCN004,London SCN,SHAC_LN
C107,Medway Community Healthcare ESD Team,England,C,FALSE,,,Medway Community Healthcare,Unit 7/8 Ambley Green,,,ME8 0NJ,Y,NQ701,AMBT_RYD,TRUST_NQ7,Medway Community Healthcare CIC,SCN_SCN009,South East SCN ,SHAC_SS
198,Medway Maritime Hospital,England,H,TRUE,,83,Windmill Road,,Gillingham,Kent,ME7 5NY,Y,RPA02,AMBT_RYD,TRUST_RPA,Medway NHS Foundation Trust,SCN_SCN009,South East SCN ,SHAC_SS
C454,Medway Stroke Association - 6 Month Assessment Provider,England,C,TRUE,16/07/2016 00:00,,"Stroke Association, Unit 7 Bailey Court",Ambley Green,Gillingham,Kent,ME8 0NJ,N,,AMBT_RYD,TRUST_SA1,Stroke Association,SCN_SCN009,South East SCN ,SHAC_SS
C134,Medway Stroke Community Assessment & Rehab Team,England,C,FALSE,,,Unit 7-8 Ambley Green,,,,ME8 0NJ,N,NQ701,AMBT_RYD,TRUST_NQ7,Medway Community Healthcare CIC,SCN_SCN009,South East SCN ,SHAC_SS
C449,Merton Community Neuro Rehab Team,England,C,TRUE,01/04/2016 00:00,,Wilson Hospital ,Cranmer Road,Mitcham,Surrey,CR4 4TP,Y,,AMBT_RRU,TRUST_RYX,Central London Community Healthcare NHS Trust,SCN_SCN004,London SCN,SHAC_LN
C448,Merton ESD Team,England,C,TRUE,01/04/2016 00:00,,Wilson Hospital ,Cranmer Road,Mitcham,Surrey,CR4 4TP,Y,,AMBT_RRU,TRUST_RYX,Central London Community Healthcare NHS Trust,SCN_SCN004,London SCN,SHAC_LN
C173,Mid Essex ESD Team,England,C,TRUE,,,Therapy Dept. St Peter’s Hospital,,,,CM9 6EG,N,NQA31,AMBT_RYC,TRUST_NQA,Provide,SCN_SCN002,East of England SCN,SHAC_ME
C242,Mid Powys Community Stroke Rehab Team,Wales,C,FALSE,,,Llandrindod Wells Hospital,,Llandrindod Wells,"Powys	",LD1 5HF,Y,7A7BN,AMBT_WAL,TRUST_7A7,Powys Teaching Health Board,,,
C478,Mid Ulster Community Stroke Team,Northern Ireland,C,TRUE,,,"Inver House, Moyle Hospital, Gloucester Avenue",,Larne,Antrim,BT40 1RP,Y,,AMBT_NIA,TRUST_ZT002,Northern Health and Social Care Trust,,,
351,Mile End Hospital,England,H,FALSE,,,"Shadwell Ward, Mile End Hospital",Bancroft Road ,London,,E1 4DG,Y,R1H13,AMBT_RRU,TRUST_R1H,Barts Health NHS Trust,SCN_SCN004,London SCN,SHAC_LN
533,Milford Hospital Inpatient Rehab Team,England,H,FALSE,01/06/2016 00:00,,Milford hospital,Tuesley Lane,Godalming,Surrey,"GU7 1UF		",N,,AMBT_RYD,TRUST_NDR,Virgin Care Ltd,SCN_SCN009,South East SCN ,SHAC_SS
C309,Milton Keynes ESD Team,England,C,TRUE,01/08/2014 00:00,,Early Stroke Rehabilitation Team ,Bletchley Community Hospital ,Milton Keynes,Bucks,MK3 6EN,Y,,AMBT_RX9,TRUST_RV3,Central and North West London NHS Foundation Trust,SCN_SCN011,Thames Valley SCN ,SHAC_SS
199,Milton Keynes General Hospital,England,H,TRUE,,79,Milton Keynes Hospital,"Standing Way, Eaglestone",Milton Keynes,Buckinghamshire,MK6 5LD,Y,RD816,AMBT_RYE,TRUST_RD8,Milton Keynes University Hospital NHS Foundation Trust,SCN_SCN011,Thames Valley SCN ,SHAC_SS
C405,Milton Keynes Six Month Assessment Provider,England,C,TRUE,01/09/2015 00:00,,Whalley Drive,Bletchley,Milton Keynes,Buckinghamshire,MK3 6EN,Y,,AMBT_RYC,TRUST_RV3,Central and North West London NHS Foundation Trust,SCN_SCN011,Thames Valley SCN ,SHAC_SS
493,Mold Community Hospital ,Wales,H,FALSE,,,Mold Community Hospital ,Ash Grove,Mold,Flintshire,CH7 1XG,Y,,AMBT_WAL,TRUST_7A1,Betsi Cadwaladr University Health Board,,,
439,Montagu Hospital ,England,H,TRUE,,,Montagu Hospital,Adwick Road,Mexborough,South Yorkshire ,S64 0AZ,Y,RP5MM,AMBT_RX8,TRUST_RP5,Doncaster and Bassetlaw Hospitals NHS Foundation Trust,SCN_SCN008,Yorkshire and The Humber SCN,SHAC_NN
C420,Morecambe Bay ESD Team,England,C,TRUE,01/10/2015 00:00,,Furness General Hospital,Barrow-in-Furness,Morecambe,Lancashire,LA14 5ED,Y,,AMBT_RX7,TRUST_RTX,University Hospitals of Morecambe Bay NHS Foundation Trust,SCN_SCN005,North West Coast SCN,SHAC_NN
200,Morriston Hospital,Wales,H,TRUE,,189,Heol Maes Eglwys,Morriston,Swansea,West Glamorgan,SA6 6NL,Y,7A31,AMBT_WAL,TRUST_7A3,Abertawe Bro Morgannwg University Health Board,,,
500,Moseley Hall Stroke Rehabilitation Unit,England,H,TRUE,,,"Ward 8, Moseley Hall Hospital",Alcester Road,"Moseley, Birmingham",,B13 8JL,Y,RYW23,AMBT_RYA,TRUST_RYW,Birmingham Community Healthcare NHS Foundation Trust,SCN_SCN003,West Midlands SCN,SHAC_ME
425,Mount Gould Hospital ,England,H,TRUE,,,Skylark Ward,Mouth Gould Hospital,Plymouth,Devon,PL4 7PY,N,NR527,AMBT_RYF,TRUST_NR5,Livewell Southwest,SCN_SCN010,South West SCN ,SHAC_SS
515,Mount Vernon - Daniels Rehabilitation Unit,England,H,TRUE,01/05/2015 00:00,,Mount Vernon Hospital,Rickmansworth Road,Northwood,Middlesex,HA6 2RN,Y,RALMV,AMBT_RRU,TRUST_RAS,Hillingdon Hospitals NHS Foundation Trust,SCN_SCN004,London SCN,SHAC_LN
C171,Mount Vernon Hospital ESD Team,England,C,TRUE,,,Mount Vernon Hospital,,,,S70 4DP,Y,RXG84,AMBT_RX8,TRUST_RXG,South West Yorkshire Partnership NHS Foundation Trust,SCN_SCN008,Yorkshire and The Humber SCN,SHAC_NN
201,Musgrove Park Hospital,England,H,TRUE,,215,Musgrove Park,,Taunton,Somerset,TA1 5DA,Y,RBA11,AMBT_RYF,TRUST_RBA,Taunton and Somerset NHS Foundation Trust,SCN_SCN010,South West SCN ,SHAC_SS
C256,MY Therapy Neuro Rehab Team & Wakefield ESD Team,England,C,TRUE,01/04/2014 00:00,,The Bungalow,"Gilcar Way	",Castleford,West Yorkshire,WF10 5QS,Y,RXF16,AMBT_RX8,TRUST_RXF,Mid Yorkshire Hospitals NHS Trust,SCN_SCN008,Yorkshire and The Humber SCN,SHAC_NN
C204,Nantwich Community Rehab Team,England,C,FALSE,01/12/2014 00:00,,Bevan House,Barony Court,Natwich,Cheshire,CW5 5RD,Y,RJN71,AMBT_RX7,TRUST_RJN,East Cheshire NHS Trust,SCN_SCN006,Greater Manchester and Eastern Cheshire SCN,SHAC_NN
495,Neath Port Talbot Hospital,Wales,H,TRUE,,,Neath Port Talbot Hospital,Baglan Way,Port Talbot,West Glamorgan,SA12 7BX,Y,,AMBT_WAL,TRUST_7A3,Abertawe Bro Morgannwg University Health Board,,,
485,Neuro Rehab Unit - National Hospital for Neurology and Neurosurgery,England,H,TRUE,,,,Queens Square,London,,WC1N 3BG,Y,RRVNQ,AMBT_RRU,TRUST_RRV,University College London Hospitals NHS Foundation Trust,SCN_SCN004,London SCN,SHAC_LN
C373,Nevill Hall 6 Month Assessment Provider,Wales,C,TRUE,01/03/2015 00:00,,Nevill Hall Hospital,Brecon Road,Abergavenny,Monmouthshire,NP7 7EG,Y,,AMBT_WAL,TRUST_7A6,Aneurin Bevan University Health Board,,,
205,Nevill Hall Hospital,Wales,H,TRUE,,,Brecon Road,,Abergavenny,Gwent,NP7 7EG,Y,7A62,AMBT_WAL,TRUST_7A6,Aneurin Bevan University Health Board,,,
203,New Cross Hospital,England,H,TRUE,,193,Wednesfield Road,,Wolverhampton,West Midlands,WV10 0QP,Y,RL403,AMBT_RYA,TRUST_RL4,Royal Wolverhampton NHS Trust,SCN_SCN003,West Midlands SCN,SHAC_ME
430,New Epsom and Ewell Community Hospital,England,H,TRUE,,,West Park,Horton Lane,Epsom,Surrey,KT19 8PB,N,NTV16,AMBT_RYD,TRUST_NTV,CSH Surrey,SCN_SCN009,South East SCN ,SHAC_SS
C354,New Forest 6 Month Assessment Provider,England,C,TRUE,,,"Long Term Condition Centre	","Fenwick, Pikes Hill, ",Lyndhurst ,Hampshire,SO43 7NG ,Y,,AMBT_RYE,TRUST_RW1,Southern Health NHS Foundation Trust ,SCN_SCN012,Wessex SCN ,SHAC_SS
C486,Newcastle upon Tyne Community Stroke Team,England,C,TRUE,01/04/2017 00:00,,Walkergate Health Centre,45 Scrogg Road,Walkergate,Newcastle upon Tyne,NE6 4EY,Y,,AMBT_RX6,TRUST_RTD,Newcastle upon Tyne Hospitals NHS Foundation Trust,SCN_SCN007,North of England SCN ,SHAC_NN
C273,Newcastle upon Tyne ESD Team,England,C,TRUE,,,Walkergate Health Centre,"Scrogg Road, Walker",Newcastle upon Tyne,Newcastle upon Tyne,NE6 4EY,Y,,AMBT_RX6,TRUST_RTD,Newcastle upon Tyne Hospitals NHS Foundation Trust,SCN_SCN007,North of England SCN ,SHAC_NN
217,Newham General Hospital,England,H,TRUE,,,Glen Road,,London,Greater London,E13 8SL,Y,R1HNH,AMBT_RRU,TRUST_R1H,Barts Health NHS Trust,SCN_SCN004,London SCN,SHAC_LN
C108,Newry and Mourne Community Stroke Rehab Team,Northern Ireland,C,TRUE,,,Daisy Hill Hospital,5 Hospital Road,Newry,County Down,BT35 8DR,Y,,AMBT_NIA,TRUST_ZT003,Southern Health and Social Care Trust,,,
320,Newton Abbot Hospital,England,H,TRUE,,,Newton Abbot,,Devon,,TQ12 2SL,Y,R1G12,AMBT_RYF,TRUST_RA9,Torbay and South Devon NHS Foundation Trust,SCN_SCN010,South West SCN ,SHAC_SS
419,Newtown Hospital,Wales,H,TRUE,,,Brynheulog Rehabilitation Unit,"Newtown Hospital, Llanfair Road",Newtown,Newtown,SY16 2DW,Y,7A732,AMBT_WAL,TRUST_7A7,Powys Teaching Health Board,,,
209,Noble's Hospital,Islands,H,TRUE,,40,Strang,,Braddan,Isle of Man,IM4 4RJ,Y,YACI,AMBT_ISA1,TRUST_YAC,Isle of Man Department of Health,,,
347,Nobles Hospital Rehabilitation Unit,Islands,H,FALSE,,,Ward 20 Rehabilitation Unit ,Nobles Hospital,Strang,Isle of Man,IM4 4RJ,Y,YK301,AMBT_ISA1,TRUST_YAC,Isle of Man Department of Health,,,
210,Norfolk and Norwich University Hospital,England,H,TRUE,,341,Colney Lane,Colney,Norwich,Norfolk,NR4 7UY,Y,RM102,AMBT_RYC,TRUST_RM1,Norfolk and Norwich University Hospitals NHS Foundation Trust,SCN_SCN002,East of England SCN,SHAC_ME
C236,Norfolk Community 6 Month Assessment Provider,England,C,TRUE,,,"Room G257, Norwich Community Hospital,","Bowthorpe Road,",Norwich,Norfolk,NR2 3TU,Y,RY312,AMBT_RYC,TRUST_RY3,Norfolk Community Health and Care NHS Trust,SCN_SCN002,East of England SCN,SHAC_ME
C160,North Bristol ESD Team,England,C,TRUE,,,Southmead Hospital,,Bristol,,BS10 5NB,Y,RVJ20,AMBT_RYF,TRUST_RVJ,North Bristol NHS Trust,SCN_SCN010,South West SCN ,SHAC_SS
313,North Bristol Hospitals,England,H,TRUE,,205,"Frenchay, Frenchay Park Road",,Bristol,,BS16 1LE,Y,RVJ20,AMBT_RX5,TRUST_RVJ,North Bristol NHS Trust,SCN_SCN010,South West SCN ,SHAC_SS
204,North Devon District Hospital,England,H,TRUE,,124,Raleigh Park,,Barnstaple,Devon,EX31 4JB,Y,RBZ12,AMBT_RYF,TRUST_RBZ,Northern Devon Healthcare NHS Trust,SCN_SCN010,South West SCN ,SHAC_SS
C445,North East Derbyshire Neuro Rehab Team,England,C,TRUE,01/04/2016 00:00,,"Therapy Unit, Clay Cross Hospital",Market Street,Clay Cross,Derbyshire,S45 9NZ,Y,,AMBT_RX9,TRUST_RY8,DERBYSHIRE COMMUNITY HEALTH SERVICES NHS FOUNDATION TRUST,SCN_SCN001,East Midlands SCN,SHAC_ME
C206,North East London Community Stroke Team,England,C,TRUE,,,Community Rehab Service,The Drive,Harold Wood,,RM3 0AR,Y,RATC6,AMBT_RRU,TRUST_RAT,North East London NHS Foundation Trust,SCN_SCN004,London SCN,SHAC_LN
207,North Manchester General Hospital,England,H,TRUE,,,Delaunays Road,,Manchester,Greater Manchester,M8 5RB,Y,RW602,AMBT_RX7,TRUST_RW6,Pennine Acute Hospitals NHS Trust,SCN_SCN006,Greater Manchester and Eastern Cheshire SCN,SHAC_NN
208,North Middlesex Hospital,England,H,TRUE,,,Sterling Way,,London,Greater London,N18 1QX,Y,RAPNM,AMBT_RRU,TRUST_RAP,North Middlesex University Hospital NHS Trust,SCN_SCN004,London SCN,SHAC_LN
C128,"North Powys Community Stroke Service, Newtown Hospital",Wales,C,FALSE,,,Brynheulog Rehabilitation Unit,,,,SY16 2DW,Y,7A732,AMBT_WAL,TRUST_7A7,Powys Teaching Health Board,,,
C306,North Sefton Community Neuro Rehab Team,England,C,TRUE,04/08/2014 00:00,,91 Zetland Street,,Southport,Merseyside,PR9 9DL,Y,,AMBT_RX7,TRUST_RW5,Lancashire Care NHS Foundation Trust,SCN_SCN005,North West Coast SCN,SHAC_NN
C190,North Somerset DARRT - 6 Month Assessment Provider,England,C,TRUE,,,Castlewood,Tickenham Road ,Clevedon ,,BS21 9AX ,N,NLT01,AMBT_RYF,TRUST_NLT,North Somerset Community Partnership CIC,SCN_SCN010,South West SCN ,SHAC_SS
C489,North Tees and Hartlepool ESD Team,England,C,TRUE,28/09/2017 00:00,,"Stockton Community Stroke Team, First Floor Everly",University Hospital of North Tees,"Hardwick, Stockton-on-tees",Durham,TS19 8PE,Y,,AMBT_RX6,TRUST_RVW,North Tees and Hartlepool NHS Foundation Trust,SCN_SCN007,North of England SCN ,SHAC_NN
C244,North Tyneside ESD Team,England,C,FALSE,04/03/2014 00:00,,Early Supported Discharge Team,"c/o North Tyneside General Hospital, Rake Lane","North Shields 	",Tyneside,NE29 8NH,Y,RTFFS,AMBT_RX6,TRUST_RTF,Northumbria Healthcare NHS Foundation Trust,SCN_SCN007,North of England SCN ,SHAC_NN
214,North Tyneside General Hospital,England,H,TRUE,,,Rake Lane,,North Shields,Tyne And Wear,NE29 8NH,Y,RTFFS,AMBT_RX6,TRUST_RTF,Northumbria Healthcare NHS Foundation Trust,SCN_SCN007,North of England SCN ,SHAC_NN
C386,North West Surrey ESD Team,England,C,TRUE,01/05/2015 00:00,,Bournewood House,Guildford Road,Cherstey,Surrey,KT160PZ,N,,AMBT_RYD,TRUST_NDR,Virgin Care Ltd,SCN_SCN009,South East SCN ,SHAC_SS
C253,North Worcestershire ESD Team,England,C,TRUE,01/04/2013 00:00,,"Isaac Maddox House, Shrub Hill Road",,,,WR4 9RW,Y,R1ADJ,AMBT_RYA,TRUST_R1A,Worcestershire Health and Care NHS Trust,SCN_SCN003,West Midlands SCN,SHAC_ME
C311,Northampton 6 Month Assessment Provider,England,C,TRUE,,,Northampton General Hospital,Cliftonville,Northampton,,NN1 5BD,N,,AMBT_RX9,TRUST_RNS,Northampton General Hospital NHS Trust,SCN_SCN001,East Midlands SCN,SHAC_ME
C325,Northampton Community Stroke Team,England,C,FALSE,,,Northampton General Hospital,,Cliftonville,Northampton,NN1 5BD,Y,,AMBT_RX9,TRUST_RNS,Northampton General Hospital NHS Trust,SCN_SCN001,East Midlands SCN,SHAC_ME
C326,Northampton ESD Team,England,C,TRUE,,,Northampton General Hospital,,Cliftonville,Northampton,NN 15BD,Y,,AMBT_RX9,TRUST_RNS,Northampton General Hospital NHS Trust,SCN_SCN001,East Midlands SCN,SHAC_ME
213,Northampton General Hospital,England,H,TRUE,,315,Cliftonville,,Northampton,Northamptonshire,NN1 5BD,Y,RNS01,AMBT_RX9,TRUST_RNS,Northampton General Hospital NHS Trust,SCN_SCN001,East Midlands SCN,SHAC_ME
538,Northamptonshire Community Stroke Beds,England,H,TRUE,12/06/2017 00:00,,"Trust Headquarters, St Mary's Hospital",London Road,Kettering,Northamptonshire,NN15 7PW,Y,,AMBT_RX9,TRUST_RP1,NORTHAMPTONSHIRE HEALTHCARE NHS FOUNDATION TRUST,SCN_SCN001,East Midlands SCN,SHAC_ME
C100,Northern Devon Healthcare ESD Team,England,C,FALSE,01/01/2015 00:00,,Raleigh Park,,Exeter,Devon,EX31 4JB,Y,RBZ12,AMBT_RYF,TRUST_RBZ,Northern Devon Healthcare NHS Trust,SCN_SCN010,South West SCN ,SHAC_SS
C361,Northern Lincolnshire and Goole Community Stroke Team - DPOW ESD Team,England,C,TRUE,01/01/2015 00:00,,West Arch Building,Diana Princess of Wales Hospital,Grimsby,,DN33 2BA,Y,,AMBT_RX8,TRUST_RJL,Northern Lincolnshire and Goole Hospitals NHS Foundation Trust,SCN_SCN008,Yorkshire and The Humber SCN,SHAC_NN
C102,Northern Lincolnshire and Goole Community Stroke Team - SGH,England,C,TRUE,,,Scunthorpe General Hospital,Cliff Gardens,,,DN15 7BH,Y,RJL32,AMBT_RX8,TRUST_RJL,Northern Lincolnshire and Goole Hospitals NHS Foundation Trust,SCN_SCN008,Yorkshire and The Humber SCN,SHAC_NN
C360,Northern Lincolnshire and Goole Community Stroke Team – DPOW,England,C,TRUE,01/01/2015 00:00,,West Arch Building,Diana Princess of Wales Hospital,,,DN33 2BA,Y,,AMBT_RX8,TRUST_RJL,Northern Lincolnshire and Goole Hospitals NHS Foundation Trust,SCN_SCN008,Yorkshire and The Humber SCN,SHAC_NN
C359,Northern Lincolnshire and Goole SGH ESD Team,England,C,TRUE,01/01/2015 00:00,,Scunthorpe General Hospital,Cliff Gardens,Scunthorpe,,DN15 7BJ,Y,,AMBT_RX8,TRUST_RJL,Northern Lincolnshire and Goole Hospitals NHS Foundation Trust,SCN_SCN008,Yorkshire and The Humber SCN,SHAC_NN
C393,Northumbria ESD Team,England,C,TRUE,01/05/2015 00:00,,North Tyneside General Hospital,Rake Lane,North Sheilds,Tyne and Wear,NE29 8NH,Y,,AMBT_RX6,TRUST_RTF,Northumbria Healthcare NHS Foundation Trust,SCN_SCN007,North of England SCN ,SHAC_NN
517,Northumbria Specialist Emergency Care Hospital HASU,England,H,TRUE,01/07/2015 00:00,280,Northumbria Specialist Emergency Care Hospital,Northumbria Way,Cramlington,Northumberland,NE23 6NZ,Y,RTF86,AMBT_RX6,TRUST_RTF,Northumbria Healthcare NHS Foundation Trust,SCN_SCN007,North of England SCN ,SHAC_NN
211,Northwick Park Hospital HASU,England,H,TRUE,,377,Watford Road,,Harrow,Middlesex,HA1 3UJ,Y,RV820,AMBT_RRU,TRUST_R1K,London North West Healthcare NHS Trust,SCN_SCN004,London SCN,SHAC_LN
324,Northwick Park Hospital SU,England,H,TRUE,,,,,,,HA1 3UJ,Y,RV820,AMBT_RRU,TRUST_R1K,London North West Healthcare NHS Trust,SCN_SCN004,London SCN,SHAC_LN
436,Norwich Community Hospital - Beech Ward,England,H,TRUE,,,Elliot House 130 Ber Street,,Norwich,Norfolk,NR1 3FR,Y,RY35G,AMBT_RYC,TRUST_RY3,Norfolk Community Health and Care NHS Trust,SCN_SCN002,East of England SCN,SHAC_ME
C165,Norwich ESD Team,England,C,TRUE,,,Elliot House 130 Ber Street,,,,NR1 3FR,Y,RY35G,AMBT_RYC,TRUST_RY3,Norfolk Community Health and Care NHS Trust,SCN_SCN002,East of England SCN,SHAC_ME
C340,Nottingham City 6 Month Assessment Provider,England,C,TRUE,01/10/2014 00:00,,Bulwell Riverside Centre,"2nd Floor, Main Street",,Nottingham,NG6 8QJ,N,,AMBT_RX9,TRUST_NR3,Nottingham CityCare Partnership CIC,SCN_SCN001,East Midlands SCN,SHAC_ME
C338,Nottingham City Community Stroke Team,England,C,TRUE,01/10/2014 00:00,,Bulwell Riverside Centre,"2nd Floor, Main Street",Nottingham,,NG6 8QJ,N,,AMBT_RX9,TRUST_NR3,Nottingham CityCare Partnership CIC,SCN_SCN001,East Midlands SCN,SHAC_ME
C339,Nottingham City ESD Team,England,C,TRUE,01/10/2014 00:00,,Bulwell Riverside Centre,"2nd Floor, Main Street",Nottingham,,NG6 8QJ,N,,AMBT_RX9,TRUST_NR3,Nottingham CityCare Partnership CIC,SCN_SCN001,East Midlands SCN,SHAC_ME
132,Nottingham City Hospital,England,H,TRUE,,397,Hucknall Road,,Nottingham,Nottinghamshire,NG5 1PB,Y,RX1CY,AMBT_RX9,TRUST_RX1,Nottingham University Hospitals NHS Trust,SCN_SCN001,East Midlands SCN,SHAC_ME
C369,Nottingham University Hospitals County Stroke Outreach,England,C,TRUE,01/04/2015 00:00,,Stroke Outreach Service,"City Campus, Hucknall Road ",Nottingham,,NG5 1PB,Y,,AMBT_RX9,TRUST_RX1,Nottingham University Hospitals NHS Trust,SCN_SCN001,East Midlands SCN,SHAC_ME
C385,NUH Complex Stroke Outreach,England,C,FALSE,03/11/2014 00:00,,Hucknall Road,,Nottingham,Nottinghamshire,NG5 1PB,Y,,AMBT_RX9,TRUST_RX1,Nottingham University Hospitals NHS Trust,SCN_SCN001,East Midlands SCN,SHAC_ME
C270,Oldham Community - ESD Team,England,C,FALSE,,,Integrated Care Centre,New Radcliffe Street,Oldham,Lancashire,OL1 1NL,Y,,AMBT_RX7,TRUST_RT2,Pennine Care NHS Foundation Trust,SCN_SCN006,Greater Manchester and Eastern Cheshire SCN,SHAC_NN
C103,Oldham Community - Rehab Team,England,C,FALSE,,,Integrated Care Centre ,New Radcliffe Street,Oldham,,OL1 1NL,Y,RT2F3,AMBT_RX7,TRUST_RT2,Pennine Care NHS Foundation Trust,SCN_SCN006,Greater Manchester and Eastern Cheshire SCN,SHAC_NN
C415,Oldham Community Stroke Team,England,C,TRUE,06/08/2015 00:00,,Integrated Care Centre,New Radcliffe Street,Oldham,Lancashire,OL1 1NL,Y,,AMBT_RX7,TRUST_RT2,Pennine Care NHS Foundation Trust,SCN_SCN006,Greater Manchester and Eastern Cheshire SCN,SHAC_NN
C469,Oldham Stroke Association 6 Month Assessment Provider,England,C,TRUE,03/11/2016 00:00,,"Stroke Association, 6th Floor Integrated Care",Radcliffe Street,Oldham,,OL1 1NL,N,,AMBT_RX7,TRUST_SA1,Stroke Association,SCN_SCN006,Greater Manchester and Eastern Cheshire SCN,SHAC_NN
c257,Outer North East London 6 Month Assessment Provider,England,C,TRUE,,,Grays Court,John Parker Close,Dagenham,Essex,RM10 9SR,Y,,AMBT_RRU,TRUST_RAT,North East London NHS Foundation Trust,SCN_SCN004,London SCN,SHAC_LN
C141,Oxford ESD Team,England,C,TRUE,,,"Acute Stroke Unit (Ward 5B),","John Radcliffe Hospital, Headley Way",Oxford,,OX3 9DU,Y,RTH08,AMBT_RYE,TRUST_RTH,Oxford University Hospitals NHS Foundation Trust,SCN_SCN011,Thames Valley SCN ,SHAC_SS
C314,Oxfordshire 6 Month Assessment Provider,England,C,FALSE,01/08/2014 00:00,,"Social & Community Services Department,",John Radcliffe Hospital,Headington,Oxfordshire,OX3 9DU,N,,AMBT_RYE,TRUST_OXF,Oxfordshire County Council,SCN_SCN011,Thames Valley SCN ,SHAC_SS
C259,Oxfordshire Reablement Service ,England,C,FALSE,,,ORS,Station Point,Eynsham,Oxfordshire,OX29 4TL,Y,,AMBT_RYE,TRUST_RNU,Oxford Health NHS Foundation Trust,SCN_SCN011,Thames Valley SCN ,SHAC_SS
530,Papworth Hospital,England,H,TRUE,08/02/2016 00:00,,Papworth Everard,,Peterborough,Cambridge,CB23 3RE,,,AMBT_RYC,TRUST_RGM,PAPWORTH HOSPITAL NHS FOUNDATION TRUST,SCN_SCN002,East of England SCN,SHAC_ME
471,Pendle Community Hospital - Marsden Stroke Unit,England,H,TRUE,08/03/2016 00:00,,Pendle Community Hospital,Leeds Road,Nelson,,BB9 9SZ,Y,RXR50,AMBT_RX7,TRUST_RXR,East Lancashire Hospitals NHS Trust,SCN_SCN005,North West Coast SCN,SHAC_NN
C135,Pennine Acute NHS Trust Community Stroke Rehab Team  ,England,C,TRUE,,,Newton Heath Health Centre,2 Old Church Street ,Manchester ,,M40 2JF,Y,RW631,AMBT_RX7,TRUST_RW6,Pennine Acute Hospitals NHS Trust,SCN_SCN006,Greater Manchester and Eastern Cheshire SCN,SHAC_NN
501,Penrith Community Hospital,England,H,TRUE,,,Penrith Community Hospital,Bridge Ln,Penrith,Cumbria,CA11 8HX,Y,,AMBT_RX7,TRUST_RNN,Cumbria Partnership NHS Foundation Trust,SCN_SCN007,North of England SCN ,SHAC_NN
C294,Penrith ESD Team,England,C,TRUE,,,Penrith Hospital,Bridge Ln,Penrith ,Cumbria,CA11 8HX,Y,,AMBT_RX7,TRUST_RNN,Cumbria Partnership NHS Foundation Trust,SCN_SCN007,North of England SCN ,SHAC_NN
484,Peterborough City Care Centre,England,H,FALSE,,,Intermediate Care Unit,"City Care Centre, Thorpe Road",Peterborough,,PE3 6DB,Y,RYV78,AMBT_RYC,TRUST_RYV,Cambridgeshire Community Services NHS Trust ,SCN_SCN002,East of England SCN,SHAC_ME
223,Peterborough City Hospital,England,H,TRUE,,169,Thorpe Road,,Peterborough,Cambridgeshire,PE3 9GZ,Y,RGN42,AMBT_RYC,TRUST_RGN,North West Anglia NHS Foundation Trust ,SCN_SCN002,East of England SCN,SHAC_ME
225,Pilgrim Hospital,England,H,TRUE,,160,Sibsey Road,,Boston,Lincolnshire,PE21 9QS,Y,RWDLA,AMBT_RX9,TRUST_RWD,United Lincolnshire Hospitals NHS Trust,SCN_SCN001,East Midlands SCN,SHAC_ME
226,Pinderfields Hospital,England,H,TRUE,,263,Aberford Road,,Wakefield,West Yorkshire,WF1 4DG,Y,RXF05,AMBT_RX8,TRUST_RXF,Mid Yorkshire Hospitals NHS Trust,SCN_SCN008,Yorkshire and The Humber SCN,SHAC_NN
C138,Plymouth Community Healthcare ESD Team,England,C,TRUE,,,"Denney Smith Unit, Mount Gould Hospital,",,,,PL4 7PY,N,NR501,AMBT_RYF,TRUST_NR5,Livewell Southwest,SCN_SCN010,South West SCN ,SHAC_SS
C264,Poole ESD Team,England,C,TRUE,,,Poole Hospital NHS Foundation Trust,Longfleet Road,Poole,Dorset,BH15 2JB,Y,,AMBT_RYF,TRUST_RD3,Poole Hospital NHS Foundation Trust,SCN_SCN012,Wessex SCN ,SHAC_SS
224,Poole Hospital,England,H,TRUE,,181,Longfleet Road,,Poole,Dorset,BH15 2JB,Y,RD300,AMBT_RYF,TRUST_RD3,Poole Hospital NHS Foundation Trust,SCN_SCN012,Wessex SCN ,SHAC_SS
C458,Portsmouth and South Eastern Hampshire Stroke Association 6 Month Review Team,England,C,TRUE,22/07/2016 00:00,,"Stroke Association -  South Central, Roman Landing","35-37 St Marys Place, Kingsway",Southampton,Hampshire,SO14 1AF,N,,AMBT_RYE,TRUST_SA1,Stroke Association,SCN_SCN012,Wessex SCN ,SHAC_SS
C145,Portsmouth Community ESD Team,England,C,TRUE,,,Southwick Hill Road,,Cosham,Hampshire,PO6 3LY,Y,RHU03,AMBT_RYE,TRUST_RHU,Portsmouth Hospitals NHS Trust,SCN_SCN012,Wessex SCN ,SHAC_SS
